{
  "format": "jinr-mc-scene",
  "format_version": "0.1",
  "source": {"tool": "hand-written", "document": "tests/debug/overlap_debug.json"},
  "units": {"length": "mm", "angle": "deg", "density": "g/cm3"},
  "world": {"material": "air", "margin_percent": 10},
  "materials": [
    {"id": "air", "name": "Воздух", "nist": "G4_AIR"},
    {"id": "iron", "name": "Железо", "nist": "G4_Fe"},
    {"id": "lead", "name": "Свинец", "nist": "G4_Pb"}
  ],
  "bodies": [
    {
      "id": "A",
      "name": "Железный куб 100 мм",
      "parent": null,
      "material": "iron",
      "transform": {
        "translation": [0, 0, 50],
        "rotation": {"convention": "identity"}
      },
      "shape": {"type": "box", "size": [100, 100, 100]},
      "verification": {
        "cad_volume": 1000000,
        "bbox": [[-50, -50, 0], [50, 50, 100]]
      }
    },
    {
      "id": "B",
      "name": "Свинцовый куб 100 мм, заходит в A на 40 мм",
      "parent": null,
      "material": "lead",
      "transform": {
        "translation": [60, 0, 50],
        "rotation": {"convention": "identity"}
      },
      "shape": {"type": "box", "size": [100, 100, 100]},
      "verification": {
        "cad_volume": 1000000,
        "bbox": [[10, -50, 0], [110, 50, 100]]
      }
    }
  ]
}
