{
  "format": "jinr-mc-scene",
  "format_version": "0.1",
  "source": {"tool": "hand-written", "document": "tests/scenes/box_rot30x_45z.json"},
  "units": {"length": "mm", "angle": "deg", "density": "g/cm3"},
  "world": {"material": "air", "margin_percent": 10},
  "materials": [
    {"id": "air", "name": "Воздух", "nist": "G4_AIR"},
    {"id": "iron", "name": "Железо", "nist": "G4_Fe"}
  ],
  "bodies": [
    {
      "id": "box",
      "name": "Коробка 20×40×70, поворот 30° вокруг x, затем 45° вокруг z (углами)",
      "parent": null,
      "material": "iron",
      "transform": {
        "translation": [150, -60, 40],
        "rotation": {"convention": "euler_xyz_extrinsic_deg", "angles": [30, 0, 45]}
      },
      "shape": {"type": "box", "size": [20, 40, 70]},
      "verification": {
        "cad_volume": 56000,
        "bbox": [[118.307115, -91.692885, -0.310889], [181.692885, -28.307115, 80.310889]]
      }
    }
  ]
}
